<?xml version="1.0"?>
<xs:schema xmlns:xs="http://www.w3.org/2001/XMLSchema"
           targetNamespace="https://www.it-academy.by"
           xmlns="https://www.it-academy.by"
           elementFormDefault="qualified">
    <xs:element name="Items">
        <xs:complexType>
            <xs:sequence>
                <xs:element ref="Item" maxOccurs="unbounded"/>
            </xs:sequence>
        </xs:complexType>
    </xs:element>

    <xs:element name="Item">
        <xs:complexType>
            <xs:sequence>
                <xs:element name="name">
                    <xs:simpleType>
                        <xs:restriction base="xs:string">
                            <xs:maxLength value="30"/>
                        </xs:restriction>
                    </xs:simpleType>
                </xs:element>
                <xs:element name="description">
                    <xs:simpleType>
                        <xs:restriction base="xs:string">
                            <xs:maxLength value="200"/>
                        </xs:restriction>
                    </xs:simpleType>
                </xs:element>
                <xs:element name="price" type="xs:decimal"/>
                <xs:element name="uniqueNumber">
                    <xs:simpleType>
                        <xs:restriction base="xs:string">
                            <xs:minLength value="5"/>
                            <xs:maxLength value="6"/>
                        </xs:restriction>
                    </xs:simpleType>
                </xs:element>
            </xs:sequence>
        </xs:complexType>
    </xs:element>
</xs:schema>